{
  "@context": [
    "https://www.w3.org/ns/did/v1",
    "https://w3id.org/security/jwk/v1"
  ],
  "id": "did:example:123",
  "verificationMethod": [
    {
      "id": "did:example:123#key-1",
      "type": "JsonWebKey2020",
      "controller": "did:example:123"
    }
  ],
  "authentication": ["did:example:123#key-1"]
}